{
  "schemaVersion": "mq.quest_questionnaire_trigger_catalog.v1",
  "catalogVersion": "1.0.0",
  "scenarioId": "quest-questionnaire-passive-2-trigger-demo",
  "label": "Passive Trigger Demo 2 Triggers",
  "package": "org.questquestionnaire.stimulusdemo2",
  "activity": "org.questquestionnaire.scenariodemo.ScenarioDemoActivity",
  "triggers": [
    {
      "triggerId": "trigger_1_complete",
      "label": "After trigger 1",
      "description": "Passive local demo trigger. The questionnaire APK decides the next configured block."
    },
    {
      "triggerId": "trigger_2_complete",
      "label": "After trigger 2",
      "description": "Passive local demo trigger. The questionnaire APK decides the next configured block."
    }
  ]
}
