{
  "schemaVersion": "mq.quest_questionnaire_trigger_catalog.v1",
  "catalogVersion": "1.0.0",
  "scenarioId": "quest-questionnaire-stimulus-demo",
  "package": "org.questquestionnaire.stimulusdemo",
  "activity": "org.questquestionnaire.stimulusdemo.StimulusUnityPlayerGameActivity",
  "label": "Questionnaire Stimulus Builder Demo",
  "triggers": [
    {
      "triggerId": "trigger_1_complete",
      "label": "After trigger 1",
      "description": "Fired once by the running APK. The questionnaire APK decides which configured block resumes next."
    }
  ]
}
